{
  "name": "10-Minute Smoky Harissa Creamy Butter Beans",
  "url": "https://www.mob.co.uk/recipes/10-minute-smoky-harissa-creamy-butter-beans",
  "image": "https://files.mob-cdn.co.uk/recipes/2025/1/10-Minute-Harissa-Beans.jpg",
  "servings": 2,
  "ingredients": [
    "350g Cherry Tomatoes",
    "2Clove Garlic",
    "1.5tbsp Tomato Purée",
    "1tbsp Harissa Paste",
    ".5tbsp Smoked Paprika",
    "2x 400g Can Butter Beans",
    "1tbsp Vegan Cream Cheese",
    "2Slice Crusty Bread",
    "15g Fresh Parsley",
    "2tbsp Tahini",
    "2tbsp Flaked Almond"
  ],
  "steps": [
    "Add the cherry tomatoes to a pan with a drizzle of olive oil and a pinch of salt. Set it over a medium-high heat and cook for about 5 mins until starting to soften and burst open. Add a splash of water if they’re catching on the bottom of the pan.",
    "Mince the garlic and add it to the tomatoes in the pan along with the tomato paste, ¾ of the harissa and the smoked paprika.",
    "Add the tinned butterbeans and ½ their liquid to the pan then stir in the vegan cream cheese. Bring the mixture to a boil then turn down the heat and simmer for 5-10 mins until the beans have softened and the broth has thickened (it should be creamy).",
    "Meanwhile, toast the bread and finely chop the herbs.",
    "To serve, ladle the beans into bowls. Drizzle over the tahini and some remaining harissa. Finish with the chopped herbs, flaked almonds and the toast on the side."
  ],
  "tags": [
    "dinner",
    "stews",
    "veggie-dishes",
    "beans",
    "most-cooked",
    "midweek",
    "healthy",
    "comfort",
    "speedy",
    "veganuary",
    "winter",
    "back-to-uni",
    "batch-cook",
    "batch-cooking",
    "under-30-minutes",
    "under-20-minutes",
    "actually-15-minutes",
    "vegan",
    "veggie",
    "dairy-free",
    "pescatarian",
    "shellfish-free",
    "egg-free",
    "mob-co-uk"
  ],
  "cookTime": "10 minutes"
}
