{
  "name": "Shredded Chicken & Warming Spring Onion Brothy Rice",
  "url": "https://www.mob.co.uk/recipes/shredded-chicken-warming-spring-onion-brothy-rice",
  "image": "https://files.mob-cdn.co.uk/recipes/2025/1/Spring-Onion-Chicken-Brothy-Rice.jpg",
  "servings": 4,
  "ingredients": [
    "200g Jasmine Rice",
    "7 Spring Onion",
    "30g Fresh Ginger",
    ".25tsp Ground White Pepper",
    "700ml Chicken Stock",
    "6 Boneless Skinless Chicken Thigh",
    "4 Pak Choi",
    "20g Fresh Coriander",
    "2tsp Toasted Sesame Oil",
    "Chilli Oil (to serve)"
  ],
  "steps": [
    "Cook the rice following packet instructions.",
    "Trim and thinly slice the spring onions. Finely grate the ginger. Add both into a saucepan, with a drizzle of sesame oil. Set the pan over a medium heat and gently cook, stirring occasionally, for 5-7 mins until the onions have wilted.",
    "Add the white pepper and pour the chicken stock in. Let it come to the boil then turn the heat down to low-medium, season with salt and gently drop the chicken thighs in. Leave for 10-15 mins until fully cooked.",
    "Meanwhile, trim and chop the pak choi into 2-3cm chunks. Pick the coriander leaves and thinly slice the stems.",
    "Once the chicken is cooked, use a slotted spoon to transfer it from the broth to a large bowl. Leave to cool for a couple of mins, then use two forks to shred it. Cover to keep warm.",
    "Add the coriander stems and pak choi into the hot broth and cook for 2-4 mins, until wilted. Then use a slotted spoon to transfer the veg to the chicken bowl. Add the sesame oil and coriander leaves and toss to combine. Taste and season the broth with salt and white pepper, if needed.",
    "To serve, share the rice between bowls and ladle the broth over. Top with the chicken mixture and a drizzle of chilli oil."
  ],
  "tags": [
    "dinner",
    "rice",
    "chicken",
    "midweek",
    "healthy",
    "comfort",
    "speedy",
    "winter",
    "batch-cook",
    "batch-cooking",
    "under-30-minutes",
    "allium-free",
    "mob-co-uk"
  ],
  "cookTime": "30 minutes"
}
