{
  "name": "Honey Za’atar Halloumi, Herby Pomegranate Slaw & Hummus",
  "url": "https://www.mob.co.uk/recipes/honey-zaatar-halloumi-herby-pomegranate-slaw-hummus",
  "image": "https://files.mob-cdn.co.uk/recipes/2025/9/Honey-Za%E2%80%99atar-Halloumi-Herby-Pomegranate-Slaw-Hummus.jpg",
  "servings": 2,
  "ingredients": [
    "0.5 Sweetheart Cabbage",
    "0.5 Red Onion",
    "15g Fresh Dill",
    "2tbsp Pomegranate Molasses",
    "0.5 Lemon",
    "2tbsp Extra Virgin Olive Oil",
    "225g Halloumi",
    "2tbsp Honey",
    "1tbsp Za’atar",
    "200g Hummus",
    "Salt",
    "Black Pepper"
  ],
  "steps": [
    "Slice the cabbage in half lengthways and finely shred. Thinly slice the red onion. Roughly chop three-quarters of the dill. Add everything to a large bowl.",
    "Drizzle over the pomegranate molasses, squeeze in the juice of half a lemon, and add the olive oil. Season with salt and pepper, then mix well to combine. Let the slaw sit and lightly pickle while you cook the halloumi.",
    "Cut the halloumi into 2cm cubes. Set a frying pan over medium-high heat (no oil needed). Fry the halloumi cubes for 1–2 mins on each side until golden and crisp. Drizzle in the honey and sprinkle over the za’atar. Cook for 30 seconds, tossing to coat, then take off the heat.",
    "Divide the hummus between two containers or plates. Spoon over the herby slaw, top with the sticky halloumi and finish with the remaining dill."
  ],
  "tags": [
    "lunch",
    "salads",
    "lunch-box",
    "lunch-box-salads",
    "lunch-meal-prep-experiment",
    "meal-prep",
    "summer",
    "veggie",
    "gluten-free",
    "nut-free",
    "pescatarian",
    "shellfish-free",
    "egg-free",
    "mob-co-uk"
  ],
  "cookTime": "25 minutes"
}
