{
  "name": "Anchovy & Fennel Bucatini",
  "url": "https://www.mob.co.uk/recipes/fennel-anchovy-pasta",
  "image": "https://files.mob-cdn.co.uk/recipes/2026/02/ANCHOVY-FENNEL-PASTA3100.jpg",
  "servings": 2,
  "ingredients": [
    "50g Pine Nuts",
    "1Bulb Fennel",
    "2Clove Garlic",
    "1tsp Fennel Seed",
    "50g Anchovy",
    "100ml White Wine",
    "3tbsp Dried Currant",
    "15g Fresh Dill",
    "1 Lemon",
    "200g Bucatini",
    "Salt (to taste, to serve)",
    "Black Pepper (to taste, to serve)",
    "Olive Oil"
  ],
  "steps": [
    "Heat the oven to 180°C fan (200°C conventional). Spread the pine nuts over a baking tray and toast for about 5 mins until golden, keeping a close eye on them as they burn fast. Set aside.",
    "Meanwhile, bring a large saucepan of salted water to the boil.",
    "Halve the fennel, remove the core and finely slice it. Place a large frying pan over a medium heat with a good glug of olive oil and the oil from the anchovy tin. Add the fennel with a pinch of salt and cook for about 15 mins, stirring often, until soft, sweet and silky.",
    "Roughly chop most of the dill, saving a few fronds to go on top at the end.",
    "When the fennel is cooked, drop the bucatini in the boiling water for 2 mins less than the pack instructions.",
    "While the pasta cooks, finely slice the garlic. Add it to the fennel along with the fennel seeds and anchovies. Cook for a couple of minutes, breaking up the anchovies as they melt into the pan.",
    "Pour in the white wine and let it bubble for a few minutes until reduced by about half. Stir through the currants, the juice of half the lemon and the chopped dill.",
    "Transfer the pasta straight into the sauce with a splash of pasta water. Add most of the pine nuts and toss everything together until glossy and well combined.",
    "Taste and season generously with salt and black pepper. Divide between bowls and finish with the remaining pine nuts and dill. Serve with the remaining lemon half, cut into wedges, for squeezing."
  ],
  "tags": [
    "lunch",
    "dinner",
    "pasta",
    "fishy-pastas",
    "feelers",
    "pescatarian",
    "shellfish-free",
    "mob-co-uk"
  ],
  "cookTime": "35 minutes"
}
