{
  "name": "Warming Veg & Bean Soup",
  "url": "https://www.mob.co.uk/recipes/warming-bean-and-veg-soup",
  "image": "https://files.mob-cdn.co.uk/recipes/2026/02/Warming-Veg-Bean-Soup.jpg",
  "servings": 4,
  "ingredients": [
    "15g Porcini Mushroom",
    "3 White Onion",
    "120g Celery",
    "1 Courgette",
    "3 Carrot",
    "2Sprig Rosemary",
    "1tsp Dried Oregano",
    "5Clove Garlic",
    "1 Lemon",
    "1tsp Chilli Flakes",
    "2tsp Vegetable Bouillon Power",
    "1x 570g Jar Drained Cannellini Beans",
    "6 Vine Tomato",
    "200g Chard",
    "30g Basil",
    "Black Pepper",
    "Salt",
    "Olive Oil"
  ],
  "steps": [
    "Soak your porcini mushrooms in around 100ml boiling water or until they are just covered.",
    "Prep time. Chop your onions, celery, courgette and carrots into chunks and finely chop your herbs and garlic. Zest and juice your lemon.",
    "Add your onions and carrots into a pan to cook first with some olive oil. Once those have softened slightly, add your celery and your courgette. After a couple of mins also add your garlic, chopped rosemary, oregano and chilli flakes",
    "While that is cooking, drain your porcini mushrooms making sure to reserve the water. Chop then add into the pan along with your lemon zest.",
    "Add the reserved mushroom stock to the pan along with your veg bouillon then add in your cannellini beans and water straight from the tin.",
    "Roughly chop your tomatoes and add them in. Give everything a good mix.",
    "Once all your veg has softened, add the remaining boiling water to your pan and simmer for 10 minutes.",
    "Chop your chard and basil and add to the pan after 5 minutes. Let it wilt then finally add in the juice of your lemon and a good grinding of black pepper. Season to taste and serve. I like to eat mine with some toasted crusty bread. Enjoy!"
  ],
  "tags": [
    "lunch",
    "dinner",
    "starter",
    "soups",
    "stews",
    "beans",
    "audit",
    "wfh-lunch",
    "vegan",
    "veggie",
    "gluten-free",
    "dairy-free",
    "nut-free",
    "pescatarian",
    "egg-free",
    "mob-co-uk"
  ],
  "cookTime": null
}
