{
  "name": "Chicken, Miso & Spring Onion Smash Rice Bowl",
  "url": "https://www.mob.co.uk/recipes/pulled-chicken-miso-spring-onion-high-protein-smash-2",
  "image": "https://files.mob-cdn.co.uk/recipes/2026/03/Chicken-Miso-Spring-Onion-Rice-Bowl.jpg",
  "servings": 2,
  "ingredients": [
    "2 Chicken Breast",
    "650ml Water",
    "2 Spring Onion",
    "2 Garlic Clove",
    "1tsp Fine Salt",
    "3 Spring Onion",
    "1Stick Celery",
    ".75 Cucumber",
    "10g Fresh Coriander",
    "1tbsp White Miso",
    "2tbsp Mayonnaise",
    "1tsp Tahini",
    "1tabtbsp Sesame Seeds",
    "2Slice Sourdough",
    "Salt",
    "Black Pepper",
    "1x 250g Pouch Microwave Rice",
    "2 Spring Onion",
    "1tbsp Crispy Chilli Oil",
    ".25 Cucumber"
  ],
  "steps": [
    "Pop the water, two of the spring onions, the garlic and the fine salt into a large saucepan and set over a high heat. Bring to the boil, then throw in the chicken breasts. Bring back to a simmer, pop the lid on and turn off the heat. Leave untouched for 25 mins, the residual heat will cook the chicken through. Then using tongs, remove the chicken from the liquid and set aside to cool.",
    "Meanwhile finely slice the remaining spring onions and celery. Roughly chop the coriander and 3/4 cucumber, thinly slicing the rest for garnish.",
    "Once the chicken is cool enough to handle, shred into pieces using two forks. In a bowl, add the chicken, miso, mayonnaise and tahini, mixing well until evenly coated. Then fold through the 3/4 of the chopped spring onions, celery, coriander, cucumber and sesame seeds, until thick, creamy and scoopable. Season with black pepper and a little salt if needed.",
    "Heat the rice and divide between bowls. Add a dollop of the chicken mixture with the sliced cucumber, remaining chopped spring onions and a drizzle of crispy chilli oil to finish."
  ],
  "tags": [
    "lunch",
    "dinner",
    "chicken",
    "meal-prep",
    "wfh-lunch",
    "mob-co-uk"
  ],
  "cookTime": "40 minutes"
}
