{
  "name": "Smashed Prawn Tacos",
  "url": "https://www.mob.co.uk/recipes/smashed-prawn-tacos",
  "image": "https://files.mob-cdn.co.uk/recipes/2024/05/220A1751-1.jpg",
  "servings": 4,
  "ingredients": [
    "500g Raw Prawn",
    "3tsp Chipotle Paste",
    "65g Sun-Dried Tomato",
    "1tsp Cumin Seeds",
    "1tbsp Fish Sauce",
    "15g Fresh Coriander",
    "200g Cabbage",
    "3 Lime",
    "2 Avocado",
    "300g Cherry Tomatoes",
    "12 Corn Tortilla",
    "Olive Oil (to serve)",
    "Salt (to serve)"
  ],
  "steps": [
    "Preheat the grill to high. Add the prawns, chipotle, sundried tomatoes, cumin and fish sauce into a food processor. Blitz until the prawns break down into a paste. If you don’t have a food processor, finely mince everything by hand until paste-like.",
    "Pick half the coriander leaves and mince the rest. Using a vegetable peeler, thinly shave the cabbage, toss with the juice of ½ a lime, then season with salt. Thinly slice the avocados.",
    "Add the cherry tomatoes to a baking tray and place under the grill for 5-10 mins until they blister and char. Transfer to a bowl and mash whilst still hot. Let them cool down and season with salt and the juice of 1 lime. Before serving, fold the minced coriander through.",
    "Divide the prawn filling between the tortillas (around 1 heaped tbsp each) and spread into one even layer, all the way to the edges. Place a non-stick frying pan over a medium-high heat with a drizzle of oil. Once hot, cook the tacos, prawn-side down, for 2-3 mins until cooked through, then flip and cook the tortilla until charred in spots. Transfer to a plate and cover. Continue until all of them are cooked.",
    "Top the tacos with cabbage, avocado, burnt tomato salsa and the remaining coriander. Serve with any remaining lime wedges."
  ],
  "tags": [
    "dinner",
    "tacos",
    "under-30-minutes",
    "pescatarian",
    "mob-co-uk"
  ],
  "cookTime": null
}
