{
  "name": "Creamy Garlic & Herby Chicken Gnocchi",
  "url": "https://www.mob.co.uk/recipes/creamy-garlic-herb-chicken-gnocchi",
  "image": "https://files.mob-cdn.co.uk/recipes/2024/09/849A0458-1.jpg",
  "servings": 3,
  "ingredients": [
    "1 Red Onion",
    "350g Chicken Breast",
    "2Clove Garlic",
    "10g Fresh Parsley",
    "500g Gnocchi",
    "1tbsp Garlic Italian Seasoning",
    "1tbsp Dried Mixed Herbs",
    "90g Sun-Dried Tomato",
    "90g Light Soft Cheese",
    "50g Grated Cheddar & Mozzarella Mix",
    "Parmesan (to serve)",
    "Salt",
    "Black Pepper"
  ],
  "steps": [
    "Finely dice the onion. Dice the chicken into chunks. Crush the garlic and finely chop the parsley.",
    "Heat the air fryer to 180°C, then tip the gnocchi into the air fryer with ½ tbsp oil from the sundried tomato jar. Cook for around 15 mins until crispy.",
    "Heat a large frying pan with another ½ tbsp sun-dried tomato oil. Add the onion with some salt, then cook for a few minutes to soften. Add the chicken and garlic and cook until softened and cooked through – about 10 minutes.⁣⁣",
    "Add the seasoning, mixed herbs, sun-dried tomatoes and soft cheese to the pan along with 3 tbsp water. Mix it together for a few minutes.",
    "Stir in the crispy gnocchi, the grated cheese and a small handful of parsley.",
    "Season to taste, then share between bowls and top with more parsley and Parmesan."
  ],
  "tags": [
    "dinner",
    "pasta",
    "gnocchi",
    "midweek",
    "healthy",
    "comfort",
    "autumn",
    "winter",
    "nut-free",
    "shellfish-free",
    "mob-co-uk"
  ],
  "cookTime": "25 minutes"
}
