{
  "name": "Fried Chilli Pork and Green Beans",
  "url": "https://www.mob.co.uk/recipes/fried-chilli-pork-and-green-beans",
  "image": "https://files.mob-cdn.co.uk/recipes/2026/01/FRIED-CHILLI-PORK-_-GREEN-BEANS.jpg",
  "servings": 4,
  "ingredients": [
    "2 Red Chilli",
    "4Clove Garlic",
    "200g Green Bean",
    "4 Spring Onion",
    "500g Pork Mince",
    "3tbsp Soy Sauce",
    "1tbsp Cornflour",
    "1tbsp Water",
    "2tsp Sugar",
    "300ml Water",
    "250g Egg Noodle",
    "Salt",
    "Ground White Pepper",
    "Vegetable Oil"
  ],
  "steps": [
    "Finely slice your red chillies. Finely chop your garlic. Take the ends off the green beans, then cut them in half. Cut your spring onions into 4cm lengths.",
    "Heat your wok over a medium heat with a splash of vegetable oil. Add your pork and season with salt. Stir fry for about 5 mins, or until the pork is browned and the liquid has evaporated off. Transfer to a bowl and set aside.",
    "Add your green beans, sliced chilli and spring onions to the same pan and fry for 3 mins, or until softened and charred. Add your garlic to the pan and cook for 30 seconds.",
    "Get your pork back into the pan, along with your soy sauce, sugar and a pinch of white pepper. Pour in the water and bring it to a gentle simmer.",
    "Bring a pan of water to a boil. Cook your noodles according to packet instructions, then drain.",
    "Mix your cornflour with a splash of water to make a slurry then pour this into the pork mixture. Give it a good mix.",
    "Allow the sauce thicken and the flavours to mingle by simmering for 3 mins. Adjust the seasoning if need be.",
    "Toss the noodles through the pork mixture and share between plates."
  ],
  "tags": [
    "lunch",
    "dinner",
    "stir-fry",
    "aldi",
    "audit",
    "fakeaway",
    "speedy",
    "dairy-free",
    "nut-free",
    "shellfish-free",
    "mob-co-uk"
  ],
  "cookTime": null
}
