{
  "name": "Cherry Bakewell Overnight Oats",
  "url": "https://www.mob.co.uk/recipes/cherry-bakewell-overnight-oats",
  "image": "https://files.mob-cdn.co.uk/recipes/2025/4/Cherry-Bakewell-Overnight-Oats.jpg",
  "servings": 4,
  "ingredients": [
    "50g Flaked Almond",
    "150g Jumbo Oat",
    "150ml Semi-Skimmed Milk",
    "200g Greek Yoghurt",
    "1tsp Vanilla Extract",
    "2tsp Almond Extract",
    "2tbsp Protein Powder",
    "3tbsp Almond Butter",
    "3tbsp Maple Syrup",
    "200g Pitted Frozen Cherries",
    "Salt"
  ],
  "steps": [
    "Heat the oven to 180°C fan.",
    "Chuck the oats into a bowl with the yoghurt, milk, vanilla extract, half the almond extract and the protein powder, if using. Mix well to combine, then set aside.",
    "In a small bowl, stir together the almond butter, the remaining almond extract, two-thirds of the maple syrup and a pinch of salt. Set aside.",
    "Tip the frozen cherries into a small saucepan with the rest of the maple syrup. Set over a low-medium heat and cook until the cherries have defrosted and are starting to release their juices. Roughly mash with a potato masher, leaving a few chunky bits.",
    "Spoon the cherry mixture into the bottom of your containers. Top with the oats, then drizzle over the almond butter mixture. Finish with a scattering of toasted flaked almonds.",
    "Cover and place in the fridge overnight."
  ],
  "tags": [
    "breakfast",
    "overnight-oats",
    "meal-prep",
    "veggie",
    "pescatarian",
    "mob-co-uk"
  ],
  "cookTime": "20 minutes"
}
