{
  "name": "Spicy Salmon Bowl with Sesame Rice & Soy Butter Spinach",
  "url": "https://www.mob.co.uk/recipes/spicy-salmon-bowl-with-sesame-rice-soy-butter-spinach",
  "image": "https://files.mob-cdn.co.uk/recipes/2025/1/Spicy-Salmon-Bowl-with-Sesame-Rice-Soy-Butter-Spinach.jpg",
  "servings": 4,
  "ingredients": [
    "500g Skinless Salmon Fillet",
    "4 Spring Onion",
    "4 Garlic Clove",
    "3tbsp Miso Paste",
    "3tbsp Sriracha",
    "2tbsp Fish Sauce",
    "2tbsp Honey",
    "1tbsp Rice Wine Vinegar",
    "200g Sushi Rice",
    "250ml Water",
    "1tsp Fine Salt",
    "2tsp Sugar",
    "1.5tbsp Rice Wine Vinegar",
    "2Sheet Nori Seaweed",
    "2tbsp Toasted Sesame Seeds",
    "3 Garlic Clove",
    "20g Butter",
    "200g Spinach",
    ".5tbsp Soy Sauce",
    ".5 Lemon",
    "Nori Seaweed (to serve)"
  ],
  "steps": [
    "Wash the sushi rice until the water runs clear. Add the rinsed rice to a saucepan along with the water. Set the pan over a high heat and let the water come to the boil then cover with a lid, turn the heat down to low and leave to cook for 12 mins. Then turn the heat off and leave it covered, undisturbed for another 10 mins.",
    "For the sauce, grate the garlic into a large bowl then add the remaining sauce ingredients and whisk until incorporated. Dice the salmon fillets into large cubes (about 3 per fillet) and add them to the sauce. Toss well to cover then transfer to a container and leave to marinate in the fridge.",
    "Now let’s make the rice seasoning. In a small bowl, whisk together the salt, sugar and vinegar and set aside. In a blender, blitz the nori into small pieces or cut into small pieces. Once the rice is cooked, stir through the seasoning liquid, nori and sesame seeds.",
    "For the spinach, thinly slice the garlic. Melt the butter in a medium saucepan set over a medium heat then add the sliced garlic and cook for about 3 mins until softened and fragrant. Add the spinach and gently wilt before seasoning with the soy sauce and a squeeze of lemon.",
    "When you want to eat, pop the salmon in the air fryer and pour over the sauce. Cook at 240°C for 3-4 mins. Heat the rice in the microwave until piping hot, if needed. Thinly slice the spring onions.",
    "To serve, spoon the rice into a bowl, top with the salmon, spooning over the sauce. Finish with the buttery spinach, spring onions and some extra nori, if you like."
  ],
  "tags": [
    "dinner",
    "seafood",
    "fish",
    "midweek",
    "salmon",
    "content-drop",
    "healthy",
    "comfort",
    "speedy",
    "spring",
    "winter",
    "batch-cook",
    "batch-cooking",
    "under-30-minutes",
    "air-fryer",
    "pescatarian",
    "mob-co-uk"
  ],
  "cookTime": "25 minutes"
}
