{
  "name": "Spicy Chorizo & Pepper Stew",
  "url": "https://www.mob.co.uk/recipes/spicy-chorizo-pepper-stew",
  "image": "https://files.mob-cdn.co.uk/recipes/2024/09/Spicy-Chorizo-Pepper-Stew.jpg",
  "servings": 4,
  "ingredients": [
    "2 Red Onion",
    "2 Garlic Clove",
    "200g Spicy Chorizo",
    "6 Jarred Grilled Red Peppers",
    "2x Can Cooked Butter Beans",
    "1x 400g Can Chopped Tomatoes",
    "25g Fresh Parsley",
    "2 Lemon",
    "70g Mayonnaise",
    "Olive Oil"
  ],
  "steps": [
    "Finely chop the red onions and thinly slice ¾ of the garlic cloves. Cut the chorizo into chunky coins and the jarred grilled red peppers into strips about 1-2 cm wide.",
    "Preheat a large saucepan over a medium-high heat and add a good glug of olive oil. Add the chorizo and cook for 3-4 mins, or until rendered and beginning to crisp up a little. Add the onions and cook for 4-5 mins with a pinch of salt before dropping in the sliced garlic.",
    "Cook together for one more minute before tipping in the butter beans, the liquid from their tins, the tinned tomatoes and the jarred peppers. Season with salt and a little pepper. Cook together for 20 mins or so until slightly reduced.",
    "Finely chop the parsley and tip into a bowl with the zest and juice of the lemons. Mix with a little olive oil.",
    "Finely grate the remaining garlic clove into a bowl with the mayonnaise and mix thoroughly.",
    "Divide the stew between warm bowls and top with a few spoons of the gremolata parsley dressing. Finish with a dollop of garlicky mayo and serve. Throw on an extra lemon wedge if you like."
  ],
  "tags": [
    "dinner",
    "stews",
    "beans",
    "one-pot-recipes",
    "high-protein-dinners",
    "high-protein",
    "chorizo",
    "most-cooked",
    "aldi",
    "midweek",
    "autumn",
    "winter",
    "dairy-free",
    "nut-free",
    "shellfish-free",
    "mob-co-uk"
  ],
  "cookTime": "40 minutes"
}
