{
  "name": "Parmesan Fried Egg With Jalapeño Salsa",
  "url": "https://www.mob.co.uk/recipes/parmesan-fried-egg",
  "image": "https://files.mob-cdn.co.uk/recipes/2024/05/Parmesan-Fried-Egg-With-Jalapen%CC%83o-Salsa.jpg",
  "servings": 1,
  "ingredients": [
    "0.25 Shallot",
    "1 Fresh Jalapeño",
    "0.5 Lime",
    "10g Fresh Coriander",
    "Flaky Sea Salt",
    "25g Mature Cheddar Cheese",
    "5g Parmesan",
    "1 Egg",
    "1 Corn Tortilla"
  ],
  "steps": [
    "Make the salsa first by finely dicing the shallot and jalapeño before combining them in a small bowl. Sprinkle with a pinch of salt and leave for 5 mins, before stirring in the lime juice, olive oil and finely chopped coriander.",
    "Coarsely grate the mature cheddar and finely grate the Parmesan. When you’re ready to eat, arrange the cheddar in a fried-egg-sized pile in a well-seasoned cast-iron or other non-stick pan and set it over a medium heat. Scatter the Parmesan over the top. Make an indent in the middle as a landing spot.",
    "Crack the egg into the target area before the cheese is fully melted, then fry for 2 ½ mins (or a tiny bit longer) until the cheese is golden and crisping. Remove from the heat before anything burns. If the egg white is not quite set, leave in the hot pan for 30–60 seconds more.",
    "Once off the heat, allow the cheese to cool and harden for 30-60 seconds more, warming the tortilla in a dry pan over a medium-high heat while you wait.",
    "Use a fish slice or spatula to carefully prize the egg and its crispy cheesy skirt from the pan, and transfer onto the warm tortilla.",
    "Spoon salsa liberally all over, fold in half and eat immediately. You’ll have some salsa leftover. Make another?"
  ],
  "tags": [
    "breakfast",
    "brunch",
    "lunch",
    "snacks",
    "eggs",
    "actually-15-minutes",
    "mob-co-uk"
  ],
  "cookTime": "15 minutes"
}
